{
  "$schema": "https://json-schema.org/draft/2020-12/schema",
  "type": "object",
  "properties": {
    "$schema": {
      "type": "string"
    },
    "name": {
      "type": "string",
      "pattern": "^[a-z][a-z0-9-]*$",
      "description": "Unique kebab-case identifier."
    },
    "title": {
      "type": "string",
      "minLength": 1
    },
    "description": {
      "type": "string",
      "minLength": 1,
      "maxLength": 200
    },
    "modules": {
      "default": [],
      "type": "array",
      "items": {
        "type": "string",
        "pattern": "^[a-z][a-z0-9-]*$",
        "description": "Unique kebab-case identifier."
      }
    },
    "sections": {
      "default": [],
      "type": "array",
      "items": {
        "type": "string",
        "pattern": "^[a-z][a-z0-9-]*$",
        "description": "Unique kebab-case identifier."
      }
    },
    "ui": {
      "default": [],
      "type": "array",
      "items": {
        "type": "string",
        "pattern": "^[a-z][a-z0-9-]*$",
        "description": "Unique kebab-case identifier."
      }
    },
    "theme": {
      "default": "neutral",
      "type": "string",
      "pattern": "^[a-z][a-z0-9-]*$",
      "description": "Unique kebab-case identifier."
    },
    "files": {
      "type": "array",
      "items": {
        "anyOf": [
          {
            "type": "string",
            "minLength": 1
          },
          {
            "type": "object",
            "properties": {
              "from": {
                "type": "string",
                "minLength": 1
              },
              "to": {
                "type": "string",
                "minLength": 1
              }
            },
            "required": [
              "from",
              "to"
            ]
          }
        ]
      }
    },
    "siteConfig": {
      "default": {},
      "type": "object",
      "propertyNames": {
        "type": "string"
      },
      "additionalProperties": {}
    }
  },
  "required": [
    "name",
    "title",
    "description"
  ]
}
